,title,permalink
0,"Lab-Grown Meat - Meat produced without killing animals is heading to your dinner table. Also called clean meat, it could eliminate much of the cruel, unethical treatment of animals and reduce the considerable environmental costs of meat production.",/r/Futurology/comments/j3tmuw/labgrown_meat_meat_produced_without_killing/
1,U.S. Government Invests in Lab-Grown Meat Research for The First Time,/r/Futurology/comments/jje236/us_government_invests_in_labgrown_meat_research/
2,Lab-grown meat company raises $55m in funding,/r/Futurology/comments/j3j0ue/labgrown_meat_company_raises_55m_in_funding/
3,The first lab-grown meat for sale could come from this Singapore startup that’s re-creating shrimp,/r/Futurology/comments/j8so8o/the_first_labgrown_meat_for_sale_could_come_from/
4,The first lab-grown meat for sale could come from this Singapore startup that's re-creating shrimp,/r/Futurology/comments/j7vksi/the_first_labgrown_meat_for_sale_could_come_from/
5,Is India ready for lab-grown meat? We interviewed two founders of Indian clean meat companies to gain an outlook of the future of the clean meat industry in the Indian market – this is what they said,/r/Futurology/comments/iycnu9/is_india_ready_for_labgrown_meat_we_interviewed/
6,"Lab-grown meat the next frontier in ethical eating: to produce one billion quarter-pounder burgers takes 1.2 million cows living for 3 years on 8,600 square kilometres of land. The same number of cultured burgers would require muscle stem cells of just 1 living cow, a month and a half to grow.",/r/Futurology/comments/d3otwg/labgrown_meat_the_next_frontier_in_ethical_eating/
7,"From bioprinting lab-grown meat in Russia to Beyond Meat in the US, KFC is embracing the future of food",/r/Futurology/comments/ht8y9l/from_bioprinting_labgrown_meat_in_russia_to/
8,Dutch startup Meatable is developing lab-grown pork and has $10 million in new financing to do it. Meatable argues that cultured (lab-grown) meat has the potential to use 96% less water and 99% less land than industrial farming.,/r/Futurology/comments/e74o85/dutch_startup_meatable_is_developing_labgrown/
9,Consumers willing to pay 40% more for Lab-Grown Meat,/r/Futurology/comments/g6xqo6/consumers_willing_to_pay_40_more_for_labgrown_meat/
10,"Lab-Grown Meat - Meat produced without killing animals is heading to your dinner table. Also called clean meat, it could eliminate much of the cruel, unethical treatment of animals and reduce the considerable environmental costs of meat production.",/r/Futurology/comments/9h4t0g/labgrown_meat_meat_produced_without_killing/
11,Negative Fallout from Lab-Grown Meats,/r/Futurology/comments/fvpm6m/negative_fallout_from_labgrown_meats/
12,How far are we from lab-grown meat ?,/r/Futurology/comments/fsn1s8/how_far_are_we_from_labgrown_meat/
13,"A new lab-grown meat startup may have overcome a key barrier to making meat without slaughter, by eliminating the need to remove any tissue from an animal, a development that would make it the least invasive method for sourcing cells yet.",/r/Futurology/comments/9jnalo/a_new_labgrown_meat_startup_may_have_overcome_a/
14,"Swapping out beef for poultry can reduce dietary carbon footprint per day by 48%, equivalent to about 3,700 miles driven by an average passenger vehicle, finds new research. In addition, plant-based and lab-grown meat are gaining ground as beef substitutes.",/r/Futurology/comments/bz4v83/swapping_out_beef_for_poultry_can_reduce_dietary/
15,Future of Food : Lab Grown Meat Technology,/r/Futurology/comments/ge42uf/future_of_food_lab_grown_meat_technology/
16,"Would you eat lab grown meat? Are plant based burgers real food? I’m meat eater, chef, and environmentalist Kimbal Musk. AMA and vote for my burger!",/r/Futurology/comments/8t29sp/would_you_eat_lab_grown_meat_are_plant_based/
17,"Lab-grown meat is about to go global, and one firm is feverishly paving the way",/r/Futurology/comments/64yf80/labgrown_meat_is_about_to_go_global_and_one_firm/
18,"Consumption of meat will need to decline sharply, as the world’s population balloons by an extra 2 billion people by 2050. A host of measures have been suggested, ranging from a tax on red meat to feeding seaweed to cows to reduce methane escaping in burps, and via lab grown meats.",/r/Futurology/comments/a9hwff/consumption_of_meat_will_need_to_decline_sharply/
19,"High steaks: Lab-grown meat necessary for future protein demands, expert says. The practice doesn't require mass slaughter of animals, or the hefty carbon footprint associated with livestock rearing.",/r/Futurology/comments/9rjmaw/high_steaks_labgrown_meat_necessary_for_future/
20,"Lab-grown meat's steady march to your plate - As costs go down and the benefits become more clear, can we afford not to eat lab-grown meat?",/r/Futurology/comments/a43eea/labgrown_meats_steady_march_to_your_plate_as/
21,How far from lab grown meat?,/r/Futurology/comments/f7unhc/how_far_from_lab_grown_meat/
22,China signs $300m deal to buy lab-grown meat from Israel,/r/Futurology/comments/70la24/china_signs_300m_deal_to_buy_labgrown_meat_from/
23,Don’t listen to Big Cattle — lab-grown meat should still be called “meat”,/r/Futurology/comments/8j3bjf/dont_listen_to_big_cattle_labgrown_meat_should/
24,Winston Churchill once postulated that the future would have lab grown meat,/r/Futurology/comments/ey7jcy/winston_churchill_once_postulated_that_the_future/
25,"Lab-Grown Meat: One Startup Has an Idea That Could Dramatically Slash Costs — thanks to one London-based startup, prices could drop to just $15 per burger",/r/Futurology/comments/cytrfi/labgrown_meat_one_startup_has_an_idea_that_could/
26,Will 2019 be the year of lab-grown meat?,/r/Futurology/comments/acwxao/will_2019_be_the_year_of_labgrown_meat/
27,"As lab-grown meat and milk inch closer to U.S. market, industry wonders who will regulate?",/r/Futurology/comments/4zcc7e/as_labgrown_meat_and_milk_inch_closer_to_us/
28,"Lab-grown meat could be on store shelves by 2022, thanks to Future Meat Technologies",/r/Futurology/comments/dg321a/labgrown_meat_could_be_on_store_shelves_by_2022/
29,Cultured or cell-based? The struggle to find the right name for lab-grown meat,/r/Futurology/comments/eccu0r/cultured_or_cellbased_the_struggle_to_find_the/
30,The new food: meet the startups racing to reinvent the meal - Lab-grown meat and food-tech companies in the US are showing that applying science to what we eat can save the world and make money,/r/Futurology/comments/8fz2ii/the_new_food_meet_the_startups_racing_to_reinvent/
31,"As the lab-grown meat industry grows, scientists debate if it could exacerbate climate change",/r/Futurology/comments/dkj4po/as_the_labgrown_meat_industry_grows_scientists/
32,IIT-Guwahati researchers develop lab-grown meat which is eco-friendly and more nutritious,/r/Futurology/comments/cvjov6/iitguwahati_researchers_develop_labgrown_meat/
33,Beef/farming industry groups have persuaded legislators to introduce laws that make it illegal to use 'meat' to describe burgers/sausages created from plant-based ingredients or grown in labs; most restrictive proposal would make it crime to sell lab-grown meat and would bar state funds for research,/r/Futurology/comments/api10r/beeffarming_industry_groups_have_persuaded/
34,"One-third of Americans are willing to eat lab-grown meat regularly - They're also more willing to eat dog, cat, and horse meat if it's grown in a lab.",/r/Futurology/comments/646jqd/onethird_of_americans_are_willing_to_eat_labgrown/
35,"The price of producing lab grown meat has dropped from $250,000/burger to $80/kilo in the last 2 years",/r/Futurology/comments/30n9qe/the_price_of_producing_lab_grown_meat_has_dropped/
36,Real texture for lab-grown meat: Researchers grow muscle cells on edible fibers,/r/Futurology/comments/dtg3so/real_texture_for_labgrown_meat_researchers_grow/
37,The lab-grown meat industry just got the regulations it’s been begging for - Taking cell-based meat products to market will require a regulatory framework. The FDA and USDA just announced one.,/r/Futurology/comments/az3d7m/the_labgrown_meat_industry_just_got_the/
38,"In India and China, consumers are eager for lab-grown meat. In the US? Not as much. New market research finds Americans divided on meat alternatives — and consumers elsewhere hungry for them.",/r/Futurology/comments/bue3h8/in_india_and_china_consumers_are_eager_for/
39,Lab Grown Meat 2019 Year in Review and Look Ahead to 2020,/r/Futurology/comments/eg1twq/lab_grown_meat_2019_year_in_review_and_look_ahead/
40,[Agriculture] Lab-Grown Meat Is Getting Cheap Enough For Anyone To Buy,/r/Futurology/comments/8maqjl/agriculture_labgrown_meat_is_getting_cheap_enough/
41,"As lab-grown meat advances, U.S. lawmakers call for regulation - Though production methods vary by company, these futuristic foods start with cells extracted from an animal and cultured to develop into strands of muscle tissue fit for frying in a nugget or pressing into a burger patty.",/r/Futurology/comments/8inuef/as_labgrown_meat_advances_us_lawmakers_call_for/
42,"Beef companies file petition against lab-grown meat startups - The US Cattlemen's Association (USCA) has filed a petition to the USDA arguing that lab-grown meat startups should not be able to call their products ""meat,"" since they do not come from slaughtered animals.",/r/Futurology/comments/9ely89/beef_companies_file_petition_against_labgrown/
43,You’ve heard of lab-grown meat. Now there’s lab-grown ice cream: Scientists have created a vegan treat that requires absolutely zilch from cows.,/r/Futurology/comments/cdnbag/youve_heard_of_labgrown_meat_now_theres_labgrown/
44,"Lab-Grown Meat Is Coming, Whether You Like It or Not",/r/Futurology/comments/7y1gat/labgrown_meat_is_coming_whether_you_like_it_or_not/
45,Israel found an unlikely buyer for its lab-grown meat: China,/r/Futurology/comments/6zwhhc/israel_found_an_unlikely_buyer_for_its_labgrown/
46,"Lab-grown meat companies see opportunity for growth, research in Canada - Cellular agriculture takes cells from animals and grows them to create milk, eggs, meat or other products.",/r/Futurology/comments/beresn/labgrown_meat_companies_see_opportunity_for/
47,Lab grown meat thirty thousand times cheaper than 18 months ago [Estimation. Repeat: Est. I. Ma. Tion ],/r/Futurology/comments/366nq4/lab_grown_meat_thirty_thousand_times_cheaper_than/
48,Lab-Grown Meat Is Getting Cheap Enough For Anyone To Buy,/r/Futurology/comments/8gkekk/labgrown_meat_is_getting_cheap_enough_for_anyone/
49,Edible insects? Lab-grown meat? The real future food is lab-grown insect meat,/r/Futurology/comments/c0lvio/edible_insects_labgrown_meat_the_real_future_food/
50,"Companies Are Betting on Lab-Grown Meat, but None Of Them Know How to Get You to Eat It",/r/Futurology/comments/854xhw/companies_are_betting_on_labgrown_meat_but_none/
51,"The Japanese government just invested in ""clean meat"" (lab-grown meat)",/r/Futurology/comments/8n8ws7/the_japanese_government_just_invested_in_clean/
52,Lab-grown meat: It’s about to be what’s for dinner,/r/Futurology/comments/8044bb/labgrown_meat_its_about_to_be_whats_for_dinner/
53,Israel vs Silicon Valley in the race for lab grown meat,/r/Futurology/comments/auw3nr/israel_vs_silicon_valley_in_the_race_for_lab/
54,A startup that turns mushrooms into IKEA packaging wants to become the backbone of the lab-grown meat industry,/r/Futurology/comments/9kr1g9/a_startup_that_turns_mushrooms_into_ikea/
55,"Lab-grown meat: how can we satisfy future demand? By 2050 global meat consumption is predicted to double However, it’s a shift the planet may not be able to sustain with traditional farming. One solution is lab-grown meat.",/r/Futurology/comments/9mowwe/labgrown_meat_how_can_we_satisfy_future_demand_by/
56,Lab-Grown Meat Draws Big Investors — And Big Opposition,/r/Futurology/comments/a6rh3g/labgrown_meat_draws_big_investors_and_big/
57,"If lab-grown meat is feasible, what about lab-grown wood?",/r/Futurology/comments/9ecy30/if_labgrown_meat_is_feasible_what_about_labgrown/
58,"Watch ""Lab-Grown Meat Is Coming to Your Supermarket. Ranchers Are Fighting Back."" on YouTube",/r/Futurology/comments/8fgzxc/watch_labgrown_meat_is_coming_to_your_supermarket/
59,Lab-Grown Meat Is Healthier. It's Cheaper. It's the Future.,/r/Futurology/comments/5wmdk3/labgrown_meat_is_healthier_its_cheaper_its_the/
60,Who's afraid of lab-grown meat? Root for this innovation to be on our plates soon,/r/Futurology/comments/6d95nz/whos_afraid_of_labgrown_meat_root_for_this/
61,Chicken Might Be the First Lab-Grown Meat to Make It to Your Grocery Store,/r/Futurology/comments/7xhq60/chicken_might_be_the_first_labgrown_meat_to_make/
62,Survey: 40% of Americans are willing to try lab-grown meat - Six in 10 vegans (from a total of 112) said they would give it a try.,/r/Futurology/comments/8k4bfh/survey_40_of_americans_are_willing_to_try/
63,Lab-Grown Meat Could Become a Restaurant Staple,/r/Futurology/comments/93p2ho/labgrown_meat_could_become_a_restaurant_staple/
64,The Future of Food Might Not Include Lab-Grown Meat After All,/r/Futurology/comments/astvov/the_future_of_food_might_not_include_labgrown/
65,"Singapore Backs Lab-Grown Meat, Robots in $535 Million Push: City-state to allocate S$724 million in tech transformation. Investments in digital tech, cell therapy, food innovation",/r/Futurology/comments/b6hu4d/singapore_backs_labgrown_meat_robots_in_535/
66,"Making meat mindfully - Animal-free meat made from plant and fungal proteins is a growing market, partly driven by consumer curiosity, and partly driven by the ecological benefits of lab-grown meat.",/r/Futurology/comments/a3r7u2/making_meat_mindfully_animalfree_meat_made_from/
67,"Lab-Grown Meat Startups Backed by Bill Gates, Tyson Foods Face FDA Oversight",/r/Futurology/comments/8rdiwv/labgrown_meat_startups_backed_by_bill_gates_tyson/
68,"Meat 2.0? Green meat? War of words over what to call lab-grown meat - 'Clean meat' implies natural meat is dirty, says one beef advocate",/r/Futurology/comments/8si2ss/meat_20_green_meat_war_of_words_over_what_to_call/
69,"Were about to get lab grown meat on the market, but whats next? Could we lab grow milk?",/r/Futurology/comments/8jl7wz/were_about_to_get_lab_grown_meat_on_the_market/
70,How to Produce & Regulate Lab-Grown Meat: Experts Explain,/r/Futurology/comments/cb32x6/how_to_produce_regulate_labgrown_meat_experts/
71,"“Despite the Increasing Hype, Lab Grown Meat is Decades Away from Appearing on Fast Food Menus”",/r/Futurology/comments/9hlc7r/despite_the_increasing_hype_lab_grown_meat_is/
72,FDA and USDA will meet to debate the future of lab-grown meat,/r/Futurology/comments/9f8s1a/fda_and_usda_will_meet_to_debate_the_future_of/
73,Would you eat lab-grown meat?,/r/Futurology/comments/34olhc/would_you_eat_labgrown_meat/
74,"Silicon Valley start-up Hampton Creek says it will have lab-grown meat on the shelves in 2018, 3 years ahead of other competitors.",/r/Futurology/comments/6kay1u/silicon_valley_startup_hampton_creek_says_it_will/
75,"Lab-Grown Meat: Better for Animals, Better for the Environment",/r/Futurology/comments/60xibs/labgrown_meat_better_for_animals_better_for_the/
76,Why This Cardiologist Is Betting That His Lab-Grown Meat Startup Can Solve the Global Food Crisis,/r/Futurology/comments/78izd9/why_this_cardiologist_is_betting_that_his/
77,"Bioengineered milk and lab-grown meat: Tech firms bet the future of food lies in alternative proteins - With the world’s population on track to exceed 9 billion by 2050, alternative proteins will be essential to feed growing numbers of hungry mouths",/r/Futurology/comments/am6zfk/bioengineered_milk_and_labgrown_meat_tech_firms/
78,Lab-grown meat is inevitable. Will we eat it?,/r/Futurology/comments/869bav/labgrown_meat_is_inevitable_will_we_eat_it/
79,"Lab grown meat could cut emissions, and save energy.",/r/Futurology/comments/9n6aap/lab_grown_meat_could_cut_emissions_and_save_energy/
80,Meet 'Schmeat': Lab-grown meat hits the grill this month,/r/Futurology/comments/1fxgct/meet_schmeat_labgrown_meat_hits_the_grill_this/
81,"Don't have a cow, man: The prospects for lab grown meat",/r/Futurology/comments/9kh9ge/dont_have_a_cow_man_the_prospects_for_lab_grown/
82,Would you eat lab grown meat?,/r/Futurology/comments/4f7y9p/would_you_eat_lab_grown_meat/
83,"""Consider the (Synthetic) Lobster"" - how lab-grown meat could turn coastal Maine into the Rust Belt",/r/Futurology/comments/7m4x69/consider_the_synthetic_lobster_how_labgrown_meat/
84,"If lab grown meats could be made with animal stem cells, could the same be done for humans?",/r/Futurology/comments/9tatcy/if_lab_grown_meats_could_be_made_with_animal_stem/
85,"The future of lab grown meat, and how consumers are likely to respond to it.",/r/Futurology/comments/4b92h1/the_future_of_lab_grown_meat_and_how_consumers/
86,"The Race To Produce Lab-Grown Meat Is Underwritten By Billionaires, Big Ag, & Venture Capitalists",/r/Futurology/comments/6zm8wi/the_race_to_produce_labgrown_meat_is_underwritten/
87,"Futurism Original: Would You Eat Synthetic, Lab-Grown Meat?",/r/Futurology/comments/5nc4kj/futurism_original_would_you_eat_synthetic/
88,How far off is a reality where we eat lab-grown meat?,/r/Futurology/comments/6dhk29/how_far_off_is_a_reality_where_we_eat_labgrown/
89,"When lab grown meat becomes as cheap as, and tastes as good as any animal based meat. Should killing animals for food become illegal? (Discussion)",/r/Futurology/comments/4vzh0v/when_lab_grown_meat_becomes_as_cheap_as_and/
90,Lab-grown meat: The future of food?,/r/Futurology/comments/6m1s38/labgrown_meat_the_future_of_food/
91,"Lab grown meat prices have dropped 30,000 times in less than four years and are about 3-4 times more expensive than regular ground beef",/r/Futurology/comments/5xn7vw/lab_grown_meat_prices_have_dropped_30000_times_in/
92,Can lab grown meats be made to reduce risk of heart cancer etc rather than increase it?,/r/Futurology/comments/54e101/can_lab_grown_meats_be_made_to_reduce_risk_of/
93,"How Lab-Grown Meat Could Be the Future of Food: ""For now, lab-grown meat remains incredibly expensive to produce, but more technological development could bring the food sooner to our dinner tables than we might think.""",/r/Futurology/comments/5crwn6/how_labgrown_meat_could_be_the_future_of_food_for/
94,"Lab Grown Meat? We have insects with small energy, carbon, and space footprints right now.",/r/Futurology/comments/30pfr6/lab_grown_meat_we_have_insects_with_small_energy/
95,Are Lab-Grown Meats Really the Future of Food?,/r/Futurology/comments/6fud1g/are_labgrown_meats_really_the_future_of_food/
96,What are we going to call lab-grown meat if/when it becomes widely available?,/r/Futurology/comments/1l1dqn/what_are_we_going_to_call_labgrown_meat_ifwhen_it/
97,I love the concept of lab-grown meat— but that name has *got* to go.,/r/Futurology/comments/4qtp3c/i_love_the_concept_of_labgrown_meat_but_that_name/
98,"An Inside Look Into How Startups and Nonprofits are Developing ""Clean Meat"" (AKA lab-grown meat)",/r/Futurology/comments/6wzbez/an_inside_look_into_how_startups_and_nonprofits/
99,looking at the reactions i am hopeful (rare) about lab-grown meat to become increasingly popular in next decades,/r/Futurology/comments/9qrt2p/looking_at_the_reactions_i_am_hopeful_rare_about/
100,Why Eating Lab-Grown Meat Will Be More Ethical Than Eating a Vegetable,/r/Futurology/comments/3pxrt0/why_eating_labgrown_meat_will_be_more_ethical/
101,Can lab-grown meat feed - and save - the world?,/r/Futurology/comments/80m032/can_labgrown_meat_feed_and_save_the_world/
102,What will happen to gelatin products if lab grown meat puts an end to livestock farming?,/r/Futurology/comments/44kkbl/what_will_happen_to_gelatin_products_if_lab_grown/
103,"Welcome to Bistro in Vitro, the world’s first lab-grown meat restaurant and the future of fine dining. Its dishes may sound like the stuff of macabre fantasy, but according to scientist and philosopher Koert van Mensvoort, we can expect to be eating meals￼ like this in the not too distant future.",/r/Futurology/comments/373egn/welcome_to_bistro_in_vitro_the_worlds_first/
104,"Lab grown meat prices have dropped 30,000 times in less than four years and are about 3-4 times more expensive than regular ground beef",/r/Futurology/comments/5v4hb1/lab_grown_meat_prices_have_dropped_30000_times_in/
105,"With the advent of lab-grown meat, how would you feel about eating lab-grown human meat?",/r/Futurology/comments/4t95gy/with_the_advent_of_labgrown_meat_how_would_you/
106,"If it were the right price, would you eat lab-grown meat?",/r/Futurology/comments/1juyp2/if_it_were_the_right_price_would_you_eat_labgrown/
107,"BiteLabs.org, a hypothetical startup venture trying to promote lab grown meat by creating sausages grown from celebrity biopsies (hoax or not, it raises strange ethical questions)",/r/Futurology/comments/1yy2ns/bitelabsorg_a_hypothetical_startup_venture_trying/
108,Which World Leader Predicted Lab-Grown Meat in 1931?,/r/Futurology/comments/759jcx/which_world_leader_predicted_labgrown_meat_in_1931/
109,How would evolution affect lab-grown meat?,/r/Futurology/comments/3p3r1x/how_would_evolution_affect_labgrown_meat/
110,Meet 7 Startups Creating Lab-Grown Meat,/r/Futurology/comments/78achx/meet_7_startups_creating_labgrown_meat/
111,Lab Grown Meat,/r/Futurology/comments/5ei5qu/lab_grown_meat/
112,"Are we ready to eat lab grown meat?: “The way we produce meat today is not going to last. There are three options: we will all become vegetarian; we will eat more insects; or, perhaps, we will eat in vitro meat.” (from r/technology)",/r/Futurology/comments/1a6pi3/are_we_ready_to_eat_lab_grown_meat_the_way_we/
113,[Question] How much will lab grown meat change the world?,/r/Futurology/comments/56sbku/question_how_much_will_lab_grown_meat_change_the/
114,The Quest for Lab-Grown Meat,/r/Futurology/comments/3bcc5q/the_quest_for_labgrown_meat/
115,The Science Behind Lab-Grown Meat,/r/Futurology/comments/5zwzs0/the_science_behind_labgrown_meat/
116,"New Harvest, the organization responsible for accelerating “lab-grown meat,"" is doing an AMA today from 11-4pm EST—check it out!",/r/Futurology/comments/48spn4/new_harvest_the_organization_responsible_for/
117,What safety standard would lab-grown meat have to achieve for you to eat it?,/r/Futurology/comments/33fxf9/what_safety_standard_would_labgrown_meat_have_to/
118,"A group of scientists and biohackers are working on making real cheese without the need for cows. Their reasons are not wholly the same, but this will have the same effects as lab grown meat.",/r/Futurology/comments/2ent7q/a_group_of_scientists_and_biohackers_are_working/
119,Lab-grown meat: Coming to a grocer near you?,/r/Futurology/comments/6i8fnb/labgrown_meat_coming_to_a_grocer_near_you/
120,"Lab grown meat is not ""fake"".",/r/Futurology/comments/3uxoyk/lab_grown_meat_is_not_fake/
121,"Meat Makers: the artificial beef revolution. Lab Grown Meat & Plant-Based Meat Technologies. [Feb, 2016]",/r/Futurology/comments/50if31/meat_makers_the_artificial_beef_revolution_lab/
122,The Futurist: The benefits of lab-grown meat,/r/Futurology/comments/349plj/the_futurist_the_benefits_of_labgrown_meat/
123,The Future of Food (lab-grown meat),/r/Futurology/comments/74juh7/the_future_of_food_labgrown_meat/
124,NeuroLogica Blog » In Praise of Lab-Grown Meat,/r/Futurology/comments/4bcdxj/neurologica_blog_in_praise_of_labgrown_meat/
125,The future of food: from jellyfish salad to lab-grown meat,/r/Futurology/comments/3kw3nq/the_future_of_food_from_jellyfish_salad_to/
126,Yum: This Lab-Grown Meat Cookbook Includes Recipes for Dodo Nuggets,/r/Futurology/comments/2j1wqe/yum_this_labgrown_meat_cookbook_includes_recipes/
127,Lab-Grown Meat is the Future of Food (Jonathan Strickland),/r/Futurology/comments/1lq09t/labgrown_meat_is_the_future_of_food_jonathan/
128,"[in-depth] A comprehensive series on the science behind cell-based (lab-grown, cultured, clean) meat, Part II: Bioprocessing",/r/Futurology/comments/ayptba/indepth_a_comprehensive_series_on_the_science/
129,What else will we see with lab grown tissue besides meat?,/r/Futurology/comments/a1rg31/what_else_will_we_see_with_lab_grown_tissue/
130,What will be the next food tech innovations?,/r/Futurology/comments/jhzkca/what_will_be_the_next_food_tech_innovations/
131,[in-depth] A comprehensive series on the science behind cell-based meat,/r/Futurology/comments/aoh0c3/indepth_a_comprehensive_series_on_the_science/
132,Insulating Humanity from Nature,/r/Futurology/comments/feex9k/insulating_humanity_from_nature/
133,"2019 has been a big year for meat alternatives. I’m Kelsey Piper, a staff writer at Vox’s Future Perfect, where I cover the growing meatless meat industry. AMA.",/r/Futurology/comments/buh7p0/2019_has_been_a_big_year_for_meat_alternatives_im/
134,Kimbal Musk is returning for another AMA on r/Futurology this friday,/r/Futurology/comments/8sm7r2/kimbal_musk_is_returning_for_another_ama_on/
135,Technology is not the magical solution,/r/Futurology/comments/e4xbvd/technology_is_not_the_magical_solution/
136,The Post-Agriculture Era,/r/Futurology/comments/fl3f8g/the_postagriculture_era/
137,"[in-depth] How it's made: the science behind cultured, clean, and cell-based meat, part 3: bioengineering strategies",/r/Futurology/comments/beybqj/indepth_how_its_made_the_science_behind_cultured/
138,Brain-computer interface and more questions about the future.,/r/Futurology/comments/akjzxi/braincomputer_interface_and_more_questions_about/
139,List of jobs of 2028 that don't exist yet. What am I missing?,/r/Futurology/comments/9x118g/list_of_jobs_of_2028_that_dont_exist_yet_what_am/
140,"An Amazing, Spectacular, Mind-Bogglingly Incredible Future Awaits Us… [Essay]",/r/Futurology/comments/8o9ncr/an_amazing_spectacular_mindbogglingly_incredible/
