,title,permalink
141,What are the things that were recently considered science fiction that I can do right now?,/r/Futurology/comments/78csvr/what_are_the_things_that_were_recently_considered/
142,Predictions for the World of Tomorrow: Working because We want to not because We have to.,/r/Futurology/comments/6s8jt8/predictions_for_the_world_of_tomorrow_working/
143,How are you preparing for our technological future?,/r/Futurology/comments/3uwcwk/how_are_you_preparing_for_our_technological_future/
144,How will the world look like in an age of abundance?,/r/Futurology/comments/2rbiku/how_will_the_world_look_like_in_an_age_of/
145,"What should be the solution to robots replacing human workers on a massive scale? Possible new solution proposed, all ideas welcome.",/r/Futurology/comments/6dkah7/what_should_be_the_solution_to_robots_replacing/
146,A small case for avoiding disaster in our future,/r/Futurology/comments/2sxxcy/a_small_case_for_avoiding_disaster_in_our_future/
147,People who frequent this subreddit have learned about many things that are on the horizon. What possible outcomes have you thought of that combines new technologies that perhaps others haven't thought of?,/r/Futurology/comments/3acqg7/people_who_frequent_this_subreddit_have_learned/
148,Lab Grown Food,/r/Futurology/comments/563lrf/lab_grown_food/
149,"Now there's mass chicken deaths, farm raised meat seems to have lots of negatives",/r/Futurology/comments/36r9ct/now_theres_mass_chicken_deaths_farm_raised_meat/
150,Futurology would benefit from better marketing,/r/Futurology/comments/506pp4/futurology_would_benefit_from_better_marketing/
151,The Endgame - Future Imperfect,/r/Futurology/comments/3lxkne/the_endgame_future_imperfect/
152,"Cultivated meat startup WildType is opening up a pre-order list for select chefs as it rolls out lab-grown, sushi-grade salmon",/r/Futurology/comments/irffwf/cultivated_meat_startup_wildtype_is_opening_up_a/
153,Beef and farming industry groups have persuaded legislators in more than a dozen states to introduce laws that would make it illegal to use the word meat to describe burgers and sausages that are created from plant-based ingredients or are grown in labs.,/r/Futurology/comments/aor705/beef_and_farming_industry_groups_have_persuaded/
154,Most Americans will happily try eating lab-grown “clean meat”,/r/Futurology/comments/95x4bu/most_americans_will_happily_try_eating_labgrown/
155,"Lab-grown 'clean' meat could be on sale by end of 2018, says producer - Cultured tissue, harvested without killing any animals, could allow scientists to grown meals’ worth of products with just a handful of starter cells",/r/Futurology/comments/81pw90/labgrown_clean_meat_could_be_on_sale_by_end_of/
156,"Tyson Foods just launched a $150m venture-capital firm to invest in meat-alternatives, including the potential of investing in lab-grown cultured meat, and other initiatives",/r/Futurology/comments/5gna0k/tyson_foods_just_launched_a_150m_venturecapital/
157,"Lab-Grown ""Clean Meat"" is Almost Here. Will You Eat It?",/r/Futurology/comments/7geh4q/labgrown_clean_meat_is_almost_here_will_you_eat_it/
158,Lab-grown insect cells could be the planet-friendly ‘meat’ of the future,/r/Futurology/comments/c2b34s/labgrown_insect_cells_could_be_the_planetfriendly/
159,‘Tasting the World’s First Lab-Grown Steak.’ I produced this episode about cultured meat...AMA,/r/Futurology/comments/a58im0/tasting_the_worlds_first_labgrown_steak_i/
160,Could lab-grown insect meat be the future of food? These Tufts University researchers believe so,/r/Futurology/comments/bwjlpm/could_labgrown_insect_meat_be_the_future_of_food/
161,Lab-grown food: 'the goal is to remove the animal from meat production',/r/Futurology/comments/6pbw77/labgrown_food_the_goal_is_to_remove_the_animal/
162,Lab Meat Is The Future - The meat of the future won't be from an animal or plants but lab grown.,/r/Futurology/comments/96og8c/lab_meat_is_the_future_the_meat_of_the_future/
163,Meet the future of meat: A $10 lab-grown hamburger that tastes as good as the real thing,/r/Futurology/comments/36mx2q/meet_the_future_of_meat_a_10_labgrown_hamburger/
164,"Slaughter-Free Lab Grown Steak Cast As Ethically Friendly Alternative - the world's first lab-grown steak that has ""the full experience of meat with the appearance, shape and texture of beef cuts.""",/r/Futurology/comments/a5y0ed/slaughterfree_lab_grown_steak_cast_as_ethically/
165,SuperMeat Secures $3 Million In Funding For Lab-Grown Chicken Meat,/r/Futurology/comments/7qmgfp/supermeat_secures_3_million_in_funding_for/
166,What Is Meat? Missouri Is Working to Legislate Against Lab-Grown Alternatives,/r/Futurology/comments/8b1s78/what_is_meat_missouri_is_working_to_legislate/
167,"A pet food startup backed by Peter Thiel is pursuing lab-grown mouse meat — but the idea worries the founders of other cultured meat startups, who say marketing cultured meat as dog food could destroy its appeal for human consumers.",/r/Futurology/comments/921fv0/a_pet_food_startup_backed_by_peter_thiel_is/
168,"Singapore government invests $700M to address artificial intelligence, cybersecurity, cell therapy, and food technology, including lab-grown 'cell-based' meat",/r/Futurology/comments/b662n9/singapore_government_invests_700m_to_address/
169,How lab-grown burgers change the conversation about meat,/r/Futurology/comments/4m1nwh/how_labgrown_burgers_change_the_conversation/
170,"The Sergey Brin-backed startup behind the world’s first lab-grown burger just got a boost in the race to transform the meat industry - $330,000 to create the world's first lab-grown burger, but he hopes to bring costs down to about $10 per burger.",/r/Futurology/comments/8zp7dl/the_sergey_brinbacked_startup_behind_the_worlds/
171,Could lab-grown fish and meat feed the world – without killing a single animal?,/r/Futurology/comments/72jxlm/could_labgrown_fish_and_meat_feed_the_world/
172,Would you eat lab grown / 3D printed meat? (poll),/r/Futurology/comments/4h5z4f/would_you_eat_lab_grown_3d_printed_meat_poll/
173,"Lab-grown milk, eggs and meat could hit store shelves in 5 years",/r/Futurology/comments/4atf24/labgrown_milk_eggs_and_meat_could_hit_store/
174,"Why the Meat Factories of the Future Will Look Like Breweries: ""Investors, many from the technology sector, are looking at 'clean meat'—meat produced without animal slaughter (cultured or 'lab-grown,' as it is often colloquially referred to)""",/r/Futurology/comments/4vypdr/why_the_meat_factories_of_the_future_will_look/
175,"Tyson Invests In Lab-Grown Protein Startup Memphis Meats, Joining Bill Gates And Richard Branson",/r/Futurology/comments/7tue30/tyson_invests_in_labgrown_protein_startup_memphis/
176,Biotech food startup Memphis Meats just unveiled lab-grown chicken @ $9000/lbs,/r/Futurology/comments/5zky77/biotech_food_startup_memphis_meats_just_unveiled/
177,"Laboratory-grown beef: meat without the murder, but would you eat it? ""Growing meat in labs could cut hunger, tackle climate change and end animal slaughter""",/r/Futurology/comments/2aux4e/laboratorygrown_beef_meat_without_the_murder_but/
178,(meat)How close are we to a hamburger grown in a lab? - CNN,/r/Futurology/comments/8zs8s2/meathow_close_are_we_to_a_hamburger_grown_in_a/
179,How production of lab grown human meat will change the world?,/r/Futurology/comments/3myngz/how_production_of_lab_grown_human_meat_will/
180,KFC will test 3D printed lab-grown chicken nuggets this fall,/r/Futurology/comments/hwe4uy/kfc_will_test_3d_printed_labgrown_chicken_nuggets/
181,"""Meat Makers"" - Economist documentary following two leaders in meat alternatives: Mark Post, founder of Mosa Meat and creator of the world's first lab grown burger, and Ethan Brown, founder of Beyond Meat.",/r/Futurology/comments/4qnqjv/meat_makers_economist_documentary_following_two/
182,A New Factory in France Will Mass-Produce Bugs as Food,/r/Futurology/comments/j7dls5/a_new_factory_in_france_will_massproduce_bugs_as/
183,This Startup Is Growing Sushi-Grade Salmon From Cells in a Lab,/r/Futurology/comments/itw7bl/this_startup_is_growing_sushigrade_salmon_from/
184,First restaurant serving cultured chicken opens up to the public,/r/Futurology/comments/jnc9eu/first_restaurant_serving_cultured_chicken_opens/
185,"The $325,000 burger - the challenge of creating lab in vitro grown meat",/r/Futurology/comments/1e8uqp/the_325000_burger_the_challenge_of_creating_lab/
186,German study shows wheat grown in a 10 layer indoor vertical farm could have a yield 220 to 600 times greater than existing farming methods,/r/Futurology/comments/i2ybzb/german_study_shows_wheat_grown_in_a_10_layer/
187,"Changing what we eat could offset years of climate-warming emissions, new analysis finds",/r/Futurology/comments/iockvd/changing_what_we_eat_could_offset_years_of/
188,"The next time the fertile soils of North America turn to dust, the consequences will hit food stocks worldwide. Drought is already becoming the “new normal” for Californians, and the fertility of the Great Plains is in any case vulnerable to human changes to a natural landscape.",/r/Futurology/comments/fr4h1w/the_next_time_the_fertile_soils_of_north_america/
189,"The future of food in a changing climate ""We must find ways to produce more food without expanding agricultural land or using significantly more nitrogen fertilizer in order to both protect biodiversity and reduce air pollutant and greenhouse gas emissions,”",/r/Futurology/comments/j196gv/the_future_of_food_in_a_changing_climate_we_must/
190,"World’s first slaughter-free lab grown fish - A San Diego foodtech startup has grown fillets of yellowtail fish entirely from cells, making the local company one of the most scientifically advanced in the world of lab-grown seafood.",/r/Futurology/comments/gn4afj/worlds_first_slaughterfree_lab_grown_fish_a_san/
191,"World’s first slaughter-free lab grown fish - A San Diego foodtech startup has grown fillets of yellowtail fish entirely from cells, making the local company one of the most scientifically advanced in the world of lab-grown seafood.",/r/Futurology/comments/elly1n/worlds_first_slaughterfree_lab_grown_fish_a_san/
192,Lab-grown food will soon destroy farming – and save the planet - Scientists are replacing crops and livestock with food made from microbes and water. It may save humanity’s bacon,/r/Futurology/comments/eo9cdy/labgrown_food_will_soon_destroy_farming_and_save/
193,How long do you think it will take for artificial intelligence to out-compete humans to the point that there will no longer be any jobs for humans?,/r/Futurology/comments/i0e3ao/how_long_do_you_think_it_will_take_for_artificial/
194,Is it realistic for cultured meat and alternative protein to become a significant industry in the next decade?,/r/Futurology/comments/gv0ann/is_it_realistic_for_cultured_meat_and_alternative/
195,6 Innovations that Humanity Needs Most,/r/Futurology/comments/hennx6/6_innovations_that_humanity_needs_most/
196,Impossible burger to be cheaper than animal meat by 2022,/r/Futurology/comments/c7zcri/impossible_burger_to_be_cheaper_than_animal_meat/
197,"Cultured meat, also known as clean, cell-based or slaughter-free meat, is grown from stem cells taken from a live animal without the need for slaughter. If commercialized successfully, it could solve many of the environmental, animal welfare and public health issues of animal agriculture.",/r/Futurology/comments/avr6xu/cultured_meat_also_known_as_clean_cellbased_or/
198,"The Coming Obsolescence of Animal Meat - Companies are racing to develop real chicken, fish, and beef that don’t require killing animals.",/r/Futurology/comments/be3pyb/the_coming_obsolescence_of_animal_meat_companies/
199,"Seafood Without The Sea: Will Lab-Grown Fish Hook Consumers? A future where cities around the globe will be home to 150,000-square-foot facilities, each able to produce enough cell-based seafood, grown from cells in a lab, to meet the consumption demands of more than 10 million nearby residents.",/r/Futurology/comments/bkx4is/seafood_without_the_sea_will_labgrown_fish_hook/
200,"US paves way to get 'lab meat' on plates - The Department of Agriculture and the Food and Drug Administration agreed to share regulation of cell-cultured food products, they said in a joint statement.",/r/Futurology/comments/9xzqm5/us_paves_way_to_get_lab_meat_on_plates_the/
201,"In 2013 it cost $330,000 to grow a hamburger in the lab. They're soon expected to sell for $11.",/r/Futurology/comments/81gihs/in_2013_it_cost_330000_to_grow_a_hamburger_in_the/
202,Burgers grown in a lab are heading to your plate. Will you bite?,/r/Futurology/comments/9fnhy3/burgers_grown_in_a_lab_are_heading_to_your_plate/
203,Tofurkey Is Suing Missouri for the Right to Call Veggie Dogs “Meat” - A new state law prohibits labeling any product as ‘meat’ unless it comes from an animal.,/r/Futurology/comments/9b4pct/tofurkey_is_suing_missouri_for_the_right_to_call/
204,"Impossible Foods makes meatless pork now, and it's scary-similar to the real thing",/r/Futurology/comments/eldf06/impossible_foods_makes_meatless_pork_now_and_its/
205,Clean Meat Will Rapidly Decrease Animal Abuse; CA To Vote on Ban of Pork from Pigs Raised in Gestation Pens,/r/Futurology/comments/9e6w0j/clean_meat_will_rapidly_decrease_animal_abuse_ca/
206,"We’ll Always Eat Meat. But More of It Won’t Be ‘Meat’ - The trend is spawning a rapidly expanding industry for meat substitutes, both plant-based and a new high tech generation grown from animal cells in laboratories.",/r/Futurology/comments/ajnryu/well_always_eat_meat_but_more_of_it_wont_be_meat/
207,"The future of food is farming cells, not cattle",/r/Futurology/comments/9llg3j/the_future_of_food_is_farming_cells_not_cattle/
208,"In 2030, Our Protein Will Come From a Lab—and We’ll All Be Better Off For It",/r/Futurology/comments/dmxv8d/in_2030_our_protein_will_come_from_a_laband_well/
209,"Memphis Meats Can Make 10,000 Cows’ Worth of Meat With 1 Single Biopsy",/r/Futurology/comments/8gvykm/memphis_meats_can_make_10000_cows_worth_of_meat/
210,"Ready for cell-cultured meat? I am Chase Purdy, author of ""Billion Dollar Burger"" — the first journalistic book on the subject. AMA!",/r/Futurology/comments/hfnte1/ready_for_cellcultured_meat_i_am_chase_purdy/
211,I feel people are underreacting to OpenAI's Jukebox. This neural network is generating waveforms themselves!,/r/Futurology/comments/gi42b9/i_feel_people_are_underreacting_to_openais/
212,"Chicken nuggets lab-grown from feathers to go on sale by end of year, company says",/r/Futurology/comments/9qbk6o/chicken_nuggets_labgrown_from_feathers_to_go_on/
213,Bill Gates backed startup is using CRISPR to grow lab meat,/r/Futurology/comments/azfvfd/bill_gates_backed_startup_is_using_crispr_to_grow/
214,How to Feed Ten Billion: Lab-Made 'Clean Meat' Burgers are Future of Food,/r/Futurology/comments/4wpxbo/how_to_feed_ten_billion_labmade_clean_meat/
215,"The burger battle: The lawsuits challenging restrictions on plant-based meat labels - ""any food product containing cell-cultured animal tissue or plant-based or insect-based food shall not be labeled meat or as a meat product.""",/r/Futurology/comments/chn3zk/the_burger_battle_the_lawsuits_challenging/
216,New $100 Million Protein Investment Fund to Focus on Vegan and Clean Meat,/r/Futurology/comments/a8n5ur/new_100_million_protein_investment_fund_to_focus/
217,"The lab-grown food industry is now lobbying in Washington: ""The Good Food Institute represents the interests of the clean (think burgers made without slaughtering cows) and plant-based food industries, many of which are working on the cutting edge of food technology.""",/r/Futurology/comments/4pn03s/the_labgrown_food_industry_is_now_lobbying_in/
218,2019 will be the year alt-meat goes mainstream,/r/Futurology/comments/aaky2n/2019_will_be_the_year_altmeat_goes_mainstream/
219,"the Future of Food: growing meat in a lab - highly nutritious, hygienic, environmentally-friendly plus cruelty free.",/r/Futurology/comments/950l1g/the_future_of_food_growing_meat_in_a_lab_highly/
220,"""We plan to do to the meat industry what the car did to the horse and buggy. Cultured meat will completely replace the status quo and make raising animals to eat them simply unthinkable.""",/r/Futurology/comments/43util/we_plan_to_do_to_the_meat_industry_what_the_car/
221,"The $280,000 lab-grown burger could be a more palatable $10 in two years",/r/Futurology/comments/cbrw2e/the_280000_labgrown_burger_could_be_a_more/
222,"Shiok Meats takes the cultured meat revolution to the seafood aisle with plans for cultured shrimp - The company’s early tests have proved successful and the company estimates that it can make a kilogram of shrimp meat for somewhere around $5,000.",/r/Futurology/comments/b1rg01/shiok_meats_takes_the_cultured_meat_revolution_to/
223,"Planted joins the meatless meat melee with its pea-protein ‘chicken’ - claims its ultra-simple meatless poultry is nearly indistinguishable from the real thing, better in other ways, and soon, cheaper.",/r/Futurology/comments/cbjuwx/planted_joins_the_meatless_meat_melee_with_its/
224,"""'Clean' meat has been science fiction and now it is science fact"": but what's so 'clean' about it? - “‘Clean’ beef would take up 99% less land, produce 96% fewer greenhouse gas emissions and over 90% less water to produce the same amount of beef”",/r/Futurology/comments/875s7c/clean_meat_has_been_science_fiction_and_now_it_is/
225,"World’s first clean beef fajita, grown from animal cells without the actual animal, was just unveiled",/r/Futurology/comments/5h05xi/worlds_first_clean_beef_fajita_grown_from_animal/
226,"Vegan burgers: now juicy, pink and bloody - Supermarkets stock up as millions of UK ‘flexitarians’ boost demand for fake meat",/r/Futurology/comments/8koa6r/vegan_burgers_now_juicy_pink_and_bloody/
